,Category,Description,Unnamed: 0,Unnamed: 0.1,label
158, Full Body Wear,With parents like you your little girl is bound to be legendary With the amount of potential she shows you on a regular basis she could easily be President of the United States someday While you wont rule that out one thing you know for sure is that shell be a Florida alum Get her on the right track early with this adorable Frill teamcolored outfit The puffsleeved tee has an embroidered Gators logo on the chest and a cute ruffle detail on the cuffs and hem The pants feature the same embroidered logo at the bottom of the left leg and ruffle detail at the hem Just think getting your girl interested in Florida now will mean opportunities to visit Gainesville during football season in the future,621,,0.0
159, Sleepwear,Sey bandeau neck                      Versatile bandeau strapless  halter straps provide dual styling options                      Cover up hides hips while minimizing rear and thighs                      Graphic all over print                       Sizes 1834 fit up to a DDD cup                      Sizes 816 fit up to a CD cup                      Cover up fits true to size                      95 Polyester  5 Spande,307,,0.0
160, Full Body Wear,Cheer on your Rutgers Scarlet Knights in this Breaking Hearts tank top You love watching the Rutgers Scarlet Knights play and you find any ecuse to show your team spirit This cool tank features printed Rutgers Scarlet Knights graphics with glitter accents a comfy triblend construct and a racerback so you can look great while showing your team pride on game day,52,,0.0
161, Protective Wear,Celebrate your Dallas Mavericks fandom with these Chevron Stripes ankle socks These socks are ideal for wearing when youre out showing off your passion for the Dallas Mavericks These socks are the perfect addition to your wardrobe with chevron stripes and woven Dallas Mavericks graphics you can show your team pride from head to toes,245,,0.0
162, Upper Body Wear Tops,Didrikson Boardman Kids set is a substantially rain set for children with durability and versatility It is a twopart set with a warm fleece top on the pants that also allows children avoid cumbersome braces,608,,0.0
163, Upper Body Wear Tops,Get your little Nebraska fan geared up for some Cornhusker basketball in this 3piece jersey jacket and shorts set from Nike featuring an embroidered logo,584,,0.0
164, Underwear,Your dream dress has arrived This long prom dress features an eyecatching glitter lace fabric and a strapless sweetheart silhouette The corset bodice and rhinestoneclad illusion waist make this look a must have for the perfect prom look The skirts classic godet hem make this prom dress ultraflattering A pair of dangling silver earrings and sky high heels finish off this classically glamorous look Model is 510,411,,0.0
165, Sportswear,Boys Embroidered Brocade Set,631,,0.0
166, Sleepwear,You go all out to dress up for Ravens game day Make sure your team spirit etends to every article of clothing with these Charmed Hearts panties They feature a pink Ravens logo printed on the front lace trim and cute bows at the waistband These panties will make sure you are as covered as you can be in Baltimore spirit,171,,0.0
167, Lower Body Wear Bottoms,Celebrate your Syracuse Orange fandom with this KO Chain fleece pullover hoodie from Nike With its bold Syracuse Orange graphics youll be ready to face those chilly temps while showing your team spirit This cool Syracuse Orange hoodie also features ThermaFIT fabric technology to help keep you warm and insulated,546,,0.0
168, Sportswear,Silky mircofibre boyleg with tulle embroidered side panels,207,,0.0
169, Full Body Wear,Show love for your Cowboys with the 3Bar Nickname adjustable hat by The Game It features boldly embroidered school and team name graphics so everyone knows which school youre representing,156,,0.0
170, Underwear,Submerge yourself in the fastpaced action of aquatic sports while boasting your support for USA Swimming in this Dive tee Featuring custom slanted team lettering with a USA Swimming crest logo over tonal diver graphics this tee ensures your team spirit will stay ahead of the rest,651,,0.0
171, Clothing Accessories,Celebrate your little girls North Carolina Tar Heels fandom with this Starburst fleece set She will look like a star in this fleece lined jacket and pants as she cheers for the North Carolina Tar Heels Although shes little the printed North Carolina Tar Heels graphics on the front of the jacket and on the left leg of the pants lets everyone know that her team spirit will grow with her,489,,0.0
172, Sleepwear,Cheer on your Rutgers Scarlet Knights in this Breaking Hearts tank top You love watching the Rutgers Scarlet Knights play and you find any ecuse to show your team spirit This cool tank features printed Rutgers Scarlet Knights graphics with glitter accents a comfy triblend construct and a racerback so you can look great while showing your team pride on game day,51,,0.0
173, Lower Body Wear Bottoms,Get an understated winterwear look with this Arch Applique windshirt It features a highquality twill and embroidered applique mascot name arched across the chest for style thats campusready,682,,0.0
174, Upper Body Wear Tops,Cheer on your favorite Colorado State Rams in the Arch Logo long sleeve Tshirt It is perfect for supporting your favorite Colorado State Rams on those chilly nights This shirt features the name and logo of the Colorado State Rams,512,,0.0
175, Underwear,The time has come for the Atlantic 10 Conference teams to battle it out for the Cross Country Championships They are ready to show off their skills Make sure to support your favorite team as they go for the win by rockin this commemorative tee It features an A10 Championship graphic on the front so everyone will know youre stoked to watch the events,34,,0.0
176, Clothing Variety Packs,Celebrate your Harvard Crimson fandom with these Gridiron Logo Lefty fleece pants Bring your team spirit to the game when you wear these Harvard Crimson sweatpants Theyve got a printed team logo on the left leg and an elastic waistband with a drawstring closure,238,,0.0
177, Upper Body Wear Tops,Premium ProModal Custom Fabric made in LA Classically tailored this top will feel like a 2nd skin double layered in front ProModal is from Beech wood and Eucalyptus that is sustainably farmed Softer than cotton with 50 more moisture wicking  120th the ecoimpact S 26 M 48 L 610,248,,0.0
178, Full Body Wear,Celebrate your Florida Gators fandom with these Chevron Stripes ankle socks These socks are ideal for wearing when youre out showing off your passion for the Florida Gators These socks are the perfect addition to your wardrobe with chevron stripes and woven Florida Gators graphics you can show your team pride from head to toes,276,,0.0
179, Clothing Accessories,V neck                      Soft molded cup bra with plush empire encircled underband provides full bust support                      Self tie halter straps                       Empire waist with functional contrasting tie flatters and disguises imperfections                      Swim short with builtin full panty                      Sizes 1834 fit up to a DDD cup                      Sizes 816 fit up to a CD cup                      Twopiece shortini fits true to size                      82 Nylon  18 Spande,297,,0.0
